[
  {
    "Q": "How do you keep a reconnected WebSocket from accepting stale or unauthorized commands?",
    "spoken": "Authenticate the connection or declared application handshake, then authorize each consequential command against current scope and state. Use operation identities, sequence or revision rules and bounded replay. A new socket does not necessarily mean a new logical task, and an old socket should not retain indefinite authority after a session change.",
    "A": "Authenticate the connection or declared application handshake, then authorize each consequential command against current scope and state. Use operation identities, sequence or revision rules and bounded replay. A new socket does not necessarily mean a new logical task, and an old socket should not retain indefinite authority after a session change.\n\nConcrete engineering case: A delayed command from a previous session overwrites a newer operation after reconnect because the server checks only socket establishment.\n\nBoundary defense: No. The transport and browser constraints determine a supported handshake pattern. Whatever the mechanism, verify current authority where effects occur.",
    "Why": "Authenticate the connection or declared application handshake, then authorize each consequential command against current scope and state. Use operation identities, sequence or revision rules and bounded replay. A new socket does not necessarily mean a new logical task, and an old socket should not retain indefinite authority after a session change.",
    "Risk": "A delayed command from a previous session overwrites a newer operation after reconnect because the server checks only socket establishment.",
    "Trade": "No. The transport and browser constraints determine a supported handshake pattern. Whatever the mechanism, verify current authority where effects occur.",
    "Try": "Reproduce this case with synthetic data, state the authoritative result and show a regression that rejects the broken behavior.",
    "domain": "frontend",
    "subdomain": "websocket-streaming",
    "module": "websocket-streaming",
    "concept": "How do you keep a reconnected WebSocket from accepting stale or unauthorized commands?",
    "difficulty": "scenario",
    "misconception_target": "Assuming this concrete failure is excluded by a happy-path success: A delayed command from a previous session overwrites a newer operation after reconnect because the server checks only socket establishment.",
    "definitions": [
      {
        "term": "Boundary: websocket streaming",
        "definition": "Authenticate the connection or declared application handshake, then authorize each consequential command against current scope and state."
      }
    ],
    "execution_timeline": "Identify the authoritative state → trace the failure boundary → inspect durable or visible evidence → test the proposed recovery",
    "example": {
      "code": "{\n  \"scenario\": \"A delayed command from a previous session overwrites a newer operation after reconnect because the server checks only socket establishment.\",\n  \"required_decision\": \"Authenticate the connection or declared application handshake, then authorize each consequential command against current scope and state\"\n}",
      "explanation": "A source-linked reasoning fixture. JSON parsing checks representation only; reproduce the actual mechanism with the chapter reference.",
      "output": "No runtime or production measurement is inferred from this reasoning fixture."
    },
    "production_case": "A delayed command from a previous session overwrites a newer operation after reconnect because the server checks only socket establishment.",
    "alternatives": [
      "No. The transport and browser constraints determine a supported handshake pattern. Whatever the mechanism, verify current authority where effects occur."
    ],
    "pitfalls": [
      "A delayed command from a previous session overwrites a newer operation after reconnect because the server checks only socket establishment."
    ],
    "complexity": "Include workload size, retained state, latency, concurrency and recovery work under the declared assumptions; the reasoning fixture is not a capacity benchmark.",
    "follow_ups": [
      {
        "Q": "Must authentication always be the first WebSocket message?",
        "A": "No. The transport and browser constraints determine a supported handshake pattern. Whatever the mechanism, verify current authority where effects occur."
      }
    ],
    "citations": [
      "https://developer.mozilla.org/en-US/docs/Web/API/WebSockets_API"
    ],
    "reviewer_status": {
      "status": "reviewed",
      "reviewer": "Codex AI technical review (user-delegated verdict; authored/self-reviewed)",
      "reviewed_at": "2026-10-24"
    }
  }
]
