[
  {
    "Q": "How should an MCP write tool defend against a forged target and a repeated effect?",
    "spoken": "Validate structured arguments, authenticate the caller through the transport’s contract and authorize the specific target at the service boundary. Bind approval, payload and owner to a durable operation identity and use a receiver-safe retry policy. Tool annotations and a descriptive name are not permission enforcement.",
    "A": "Validate structured arguments, authenticate the caller through the transport’s contract and authorize the specific target at the service boundary. Bind approval, payload and owner to a durable operation identity and use a receiver-safe retry policy. Tool annotations and a descriptive name are not permission enforcement.\n\nConcrete engineering case: A model changes the owner field in an otherwise valid tool call and retries it after a lost acknowledgment.\n\nBoundary defense: No. Approval authority must come from a trusted interaction or policy record, bound to the intended action and protected from arbitrary model input.",
    "Why": "Validate structured arguments, authenticate the caller through the transport’s contract and authorize the specific target at the service boundary. Bind approval, payload and owner to a durable operation identity and use a receiver-safe retry policy. Tool annotations and a descriptive name are not permission enforcement.",
    "Risk": "A model changes the owner field in an otherwise valid tool call and retries it after a lost acknowledgment.",
    "Trade": "No. Approval authority must come from a trusted interaction or policy record, bound to the intended action and protected from arbitrary model input.",
    "Try": "Reproduce this case with synthetic data, state the authoritative result and show a regression that rejects the broken behavior.",
    "domain": "agents",
    "subdomain": "mcp-server-engineering",
    "module": "mcp-server-engineering",
    "concept": "How should an MCP write tool defend against a forged target and a repeated effect?",
    "difficulty": "scenario",
    "misconception_target": "Assuming this concrete failure is excluded by a happy-path success: A model changes the owner field in an otherwise valid tool call and retries it after a lost acknowledgment.",
    "definitions": [
      {
        "term": "Boundary: mcp server engineering",
        "definition": "Validate structured arguments, authenticate the caller through the transport’s contract and authorize the specific target at the service boundary."
      }
    ],
    "execution_timeline": "Identify the authoritative state → trace the failure boundary → inspect durable or visible evidence → test the proposed recovery",
    "example": {
      "code": "{\n  \"scenario\": \"A model changes the owner field in an otherwise valid tool call and retries it after a lost acknowledgment.\",\n  \"required_decision\": \"Validate structured arguments, authenticate the caller through the transport’s contract and authorize the specific target at the service boundary\"\n}",
      "explanation": "A source-linked reasoning fixture. JSON parsing checks representation only; reproduce the actual mechanism with the chapter reference.",
      "output": "No runtime or production measurement is inferred from this reasoning fixture."
    },
    "production_case": "A model changes the owner field in an otherwise valid tool call and retries it after a lost acknowledgment.",
    "alternatives": [
      "No. Approval authority must come from a trusted interaction or policy record, bound to the intended action and protected from arbitrary model input."
    ],
    "pitfalls": [
      "A model changes the owner field in an otherwise valid tool call and retries it after a lost acknowledgment."
    ],
    "complexity": "Include workload size, retained state, latency, concurrency and recovery work under the declared assumptions; the reasoning fixture is not a capacity benchmark.",
    "follow_ups": [
      {
        "Q": "Is a boolean approved argument supplied by the model adequate approval evidence?",
        "A": "No. Approval authority must come from a trusted interaction or policy record, bound to the intended action and protected from arbitrary model input."
      }
    ],
    "citations": [
      "https://github.com/modelcontextprotocol/python-sdk",
      "https://modelcontextprotocol.io/specification/2026-07-28/server/tools",
      "https://modelcontextprotocol.io/specification/2026-07-28/basic/authorization",
      "https://py.sdk.modelcontextprotocol.io/get-started/first-steps/"
    ],
    "reviewer_status": {
      "status": "draft",
      "reviewer": "Independent review pending",
      "reviewed_at": "2026-10-21"
    }
  }
]
