[
  {
    "Q": "How do MCP package versions and negotiated wire profiles differ on STDIO and HTTP?",
    "spoken": "An SDK release can support several wire profiles or compatibility paths. Record and assert the profile actually used, then check required capabilities. STDIO inherits a local subprocess boundary, while HTTP additionally needs its declared remote authentication and transport policy. Neither discovery nor valid schemas alone authorizes a resource read.",
    "A": "An SDK release can support several wire profiles or compatibility paths. Record and assert the profile actually used, then check required capabilities. STDIO inherits a local subprocess boundary, while HTTP additionally needs its declared remote authentication and transport policy. Neither discovery nor valid schemas alone authorizes a resource read.\n\nConcrete engineering case: A client silently falls back to an older lifecycle while the application assumes metadata required by a newer profile.\n\nBoundary defense: No. Pin the dependency and execute an actual client/server exchange on the relevant transport, including unsupported-version and denied-input cases.",
    "Why": "An SDK release can support several wire profiles or compatibility paths. Record and assert the profile actually used, then check required capabilities. STDIO inherits a local subprocess boundary, while HTTP additionally needs its declared remote authentication and transport policy. Neither discovery nor valid schemas alone authorizes a resource read.",
    "Risk": "A client silently falls back to an older lifecycle while the application assumes metadata required by a newer profile.",
    "Trade": "No. Pin the dependency and execute an actual client/server exchange on the relevant transport, including unsupported-version and denied-input cases.",
    "Try": "Reproduce this case with synthetic data, state the authoritative result and show a regression that rejects the broken behavior.",
    "domain": "agents",
    "subdomain": "mcp-foundations",
    "module": "mcp-foundations",
    "concept": "How do MCP package versions and negotiated wire profiles differ on STDIO and HTTP?",
    "difficulty": "scenario",
    "misconception_target": "Assuming this concrete failure is excluded by a happy-path success: A client silently falls back to an older lifecycle while the application assumes metadata required by a newer profile.",
    "definitions": [
      {
        "term": "Boundary: mcp foundations",
        "definition": "An SDK release can support several wire profiles or compatibility paths."
      }
    ],
    "execution_timeline": "Identify the authoritative state → trace the failure boundary → inspect durable or visible evidence → test the proposed recovery",
    "example": {
      "code": "{\n  \"scenario\": \"A client silently falls back to an older lifecycle while the application assumes metadata required by a newer profile.\",\n  \"required_decision\": \"An SDK release can support several wire profiles or compatibility paths\"\n}",
      "explanation": "A source-linked reasoning fixture. JSON parsing checks representation only; reproduce the actual mechanism with the chapter reference.",
      "output": "No runtime or production measurement is inferred from this reasoning fixture."
    },
    "production_case": "A client silently falls back to an older lifecycle while the application assumes metadata required by a newer profile.",
    "alternatives": [
      "No. Pin the dependency and execute an actual client/server exchange on the relevant transport, including unsupported-version and denied-input cases."
    ],
    "pitfalls": [
      "A client silently falls back to an older lifecycle while the application assumes metadata required by a newer profile."
    ],
    "complexity": "Include workload size, retained state, latency, concurrency and recovery work under the declared assumptions; the reasoning fixture is not a capacity benchmark.",
    "follow_ups": [
      {
        "Q": "Can you infer current interoperability from a copied SDK snippet?",
        "A": "No. Pin the dependency and execute an actual client/server exchange on the relevant transport, including unsupported-version and denied-input cases."
      }
    ],
    "citations": [
      "https://modelcontextprotocol.io/specification/2026-07-28/server/tools",
      "https://github.com/modelcontextprotocol/python-sdk",
      "https://modelcontextprotocol.io/specification/2026-07-28/basic/authorization"
    ],
    "reviewer_status": {
      "status": "reviewed",
      "reviewer": "Codex AI technical review (user-delegated verdict; authored/self-reviewed)",
      "reviewed_at": "2026-10-24"
    }
  }
]
