[
  {
    "Q": "How should a live assistant handle a perception update that invalidates its pending plan?",
    "spoken": "Bind observations and plans to revisioned context, cancel obsolete local work where appropriate and reject actions whose prerequisites no longer hold. Separate a new observation from evidence that a previous effect was undone. Bound update frequency and queue age so the assistant does not act on a backlog of stale state.",
    "A": "Bind observations and plans to revisioned context, cancel obsolete local work where appropriate and reject actions whose prerequisites no longer hold. Separate a new observation from evidence that a previous effect was undone. Bound update frequency and queue age so the assistant does not act on a backlog of stale state.\n\nConcrete engineering case: A screen changes while a live agent prepares a click. The delayed action targets the old location and activates another control.\n\nBoundary defense: No. Validate current state and action preconditions at dispatch, and use a recovery policy when effects become uncertain.",
    "Why": "Bind observations and plans to revisioned context, cancel obsolete local work where appropriate and reject actions whose prerequisites no longer hold. Separate a new observation from evidence that a previous effect was undone. Bound update frequency and queue age so the assistant does not act on a backlog of stale state.",
    "Risk": "A screen changes while a live agent prepares a click. The delayed action targets the old location and activates another control.",
    "Trade": "No. Validate current state and action preconditions at dispatch, and use a recovery policy when effects become uncertain.",
    "Try": "Reproduce this case with synthetic data, state the authoritative result and show a regression that rejects the broken behavior.",
    "domain": "ai-rag",
    "subdomain": "live-agents",
    "module": "live-agents",
    "concept": "How should a live assistant handle a perception update that invalidates its pending plan?",
    "difficulty": "scenario",
    "misconception_target": "Assuming this concrete failure is excluded by a happy-path success: A screen changes while a live agent prepares a click. The delayed action targets the old location and activates another control.",
    "definitions": [
      {
        "term": "Boundary: live agents",
        "definition": "Bind observations and plans to revisioned context, cancel obsolete local work where appropriate and reject actions whose prerequisites no longer hold."
      }
    ],
    "execution_timeline": "Identify the authoritative state → trace the failure boundary → inspect durable or visible evidence → test the proposed recovery",
    "example": {
      "code": "{\n  \"scenario\": \"A screen changes while a live agent prepares a click. The delayed action targets the old location and activates another control.\",\n  \"required_decision\": \"Bind observations and plans to revisioned context, cancel obsolete local work where appropriate and reject actions whose prerequisites no longer hold\"\n}",
      "explanation": "A source-linked reasoning fixture. JSON parsing checks representation only; reproduce the actual mechanism with the chapter reference.",
      "output": "No runtime or production measurement is inferred from this reasoning fixture."
    },
    "production_case": "A screen changes while a live agent prepares a click. The delayed action targets the old location and activates another control.",
    "alternatives": [
      "No. Validate current state and action preconditions at dispatch, and use a recovery policy when effects become uncertain."
    ],
    "pitfalls": [
      "A screen changes while a live agent prepares a click. The delayed action targets the old location and activates another control."
    ],
    "complexity": "Include workload size, retained state, latency, concurrency and recovery work under the declared assumptions; the reasoning fixture is not a capacity benchmark.",
    "follow_ups": [
      {
        "Q": "Is a faster perception loop alone enough?",
        "A": "No. Validate current state and action preconditions at dispatch, and use a recovery policy when effects become uncertain."
      }
    ],
    "citations": [
      "https://opentelemetry.io/docs/concepts/signals/"
    ],
    "reviewer_status": {
      "status": "reviewed",
      "reviewer": "Codex AI technical review (user-delegated verdict; authored/self-reviewed)",
      "reviewed_at": "2026-10-24"
    }
  }
]
