[
  {
    "Q": "When does a LangChain abstraction need to be replaced with a smaller explicit boundary?",
    "spoken": "Use an abstraction while it makes the required data flow, retries, callbacks and authority observable. If hidden behavior makes lifecycle or error handling ambiguous, inspect and configure it or isolate a smaller explicit adapter. Do not let a convenience wrapper own business authorization simply because it already calls the model.",
    "A": "Use an abstraction while it makes the required data flow, retries, callbacks and authority observable. If hidden behavior makes lifecycle or error handling ambiguous, inspect and configure it or isolate a smaller explicit adapter. Do not let a convenience wrapper own business authorization simply because it already calls the model.\n\nConcrete engineering case: A chain retries a mutation-bearing tool automatically after a transport error and the receiver commits twice.\n\nBoundary defense: No. The receiver’s commit and deduplication contract remain application concerns across every framework.",
    "Why": "Use an abstraction while it makes the required data flow, retries, callbacks and authority observable. If hidden behavior makes lifecycle or error handling ambiguous, inspect and configure it or isolate a smaller explicit adapter. Do not let a convenience wrapper own business authorization simply because it already calls the model.",
    "Risk": "A chain retries a mutation-bearing tool automatically after a transport error and the receiver commits twice.",
    "Trade": "No. The receiver’s commit and deduplication contract remain application concerns across every framework.",
    "Try": "Reproduce this case with synthetic data, state the authoritative result and show a regression that rejects the broken behavior.",
    "domain": "ai-rag",
    "subdomain": "langchain",
    "module": "langchain",
    "concept": "When does a LangChain abstraction need to be replaced with a smaller explicit boundary?",
    "difficulty": "scenario",
    "misconception_target": "Assuming this concrete failure is excluded by a happy-path success: A chain retries a mutation-bearing tool automatically after a transport error and the receiver commits twice.",
    "definitions": [
      {
        "term": "Boundary: langchain",
        "definition": "Use an abstraction while it makes the required data flow, retries, callbacks and authority observable."
      }
    ],
    "execution_timeline": "Identify the authoritative state → trace the failure boundary → inspect durable or visible evidence → test the proposed recovery",
    "example": {
      "code": "{\n  \"scenario\": \"A chain retries a mutation-bearing tool automatically after a transport error and the receiver commits twice.\",\n  \"required_decision\": \"Use an abstraction while it makes the required data flow, retries, callbacks and authority observable\"\n}",
      "explanation": "A source-linked reasoning fixture. JSON parsing checks representation only; reproduce the actual mechanism with the chapter reference.",
      "output": "No runtime or production measurement is inferred from this reasoning fixture."
    },
    "production_case": "A chain retries a mutation-bearing tool automatically after a transport error and the receiver commits twice.",
    "alternatives": [
      "No. The receiver’s commit and deduplication contract remain application concerns across every framework."
    ],
    "pitfalls": [
      "A chain retries a mutation-bearing tool automatically after a transport error and the receiver commits twice."
    ],
    "complexity": "Include workload size, retained state, latency, concurrency and recovery work under the declared assumptions; the reasoning fixture is not a capacity benchmark.",
    "follow_ups": [
      {
        "Q": "Does switching frameworks remove the need for an effect identity?",
        "A": "No. The receiver’s commit and deduplication contract remain application concerns across every framework."
      }
    ],
    "citations": [
      "https://docs.langchain.com/oss/python/langchain/tools",
      "https://docs.langchain.com/oss/python/langchain/streaming"
    ],
    "reviewer_status": {
      "status": "draft",
      "reviewer": "Independent review pending",
      "reviewed_at": "2026-10-21"
    }
  }
]
