[
  {
    "Q": "When is a deterministic workflow preferable to a planner or multi-agent pattern?",
    "spoken": "Choose a fixed workflow when the permitted steps and recovery conditions are known and dynamic selection adds little value. A planner can help when task decomposition or capability choice genuinely varies, but requires evaluation of authority, loop limits and uncertainty. Compare the simplest baseline under the same task and operational budget.",
    "A": "Choose a fixed workflow when the permitted steps and recovery conditions are known and dynamic selection adds little value. A planner can help when task decomposition or capability choice genuinely varies, but requires evaluation of authority, loop limits and uncertainty. Compare the simplest baseline under the same task and operational budget.\n\nConcrete engineering case: A three-step policy lookup becomes a five-agent debate with more latency but no measurable quality improvement.\n\nBoundary defense: A representative task set where adaptive choices improve meaningful outcomes enough to justify additional cost, failure paths and review burden.",
    "Why": "Choose a fixed workflow when the permitted steps and recovery conditions are known and dynamic selection adds little value. A planner can help when task decomposition or capability choice genuinely varies, but requires evaluation of authority, loop limits and uncertainty. Compare the simplest baseline under the same task and operational budget.",
    "Risk": "A three-step policy lookup becomes a five-agent debate with more latency but no measurable quality improvement.",
    "Trade": "A representative task set where adaptive choices improve meaningful outcomes enough to justify additional cost, failure paths and review burden.",
    "Try": "Reproduce this case with synthetic data, state the authoritative result and show a regression that rejects the broken behavior.",
    "domain": "agents",
    "subdomain": "agent-patterns",
    "module": "agent-patterns",
    "concept": "When is a deterministic workflow preferable to a planner or multi-agent pattern?",
    "difficulty": "scenario",
    "misconception_target": "Assuming this concrete failure is excluded by a happy-path success: A three-step policy lookup becomes a five-agent debate with more latency but no measurable quality improvement.",
    "definitions": [
      {
        "term": "Boundary: agent patterns",
        "definition": "Choose a fixed workflow when the permitted steps and recovery conditions are known and dynamic selection adds little value."
      }
    ],
    "execution_timeline": "Identify the authoritative state → trace the failure boundary → inspect durable or visible evidence → test the proposed recovery",
    "example": {
      "code": "{\n  \"scenario\": \"A three-step policy lookup becomes a five-agent debate with more latency but no measurable quality improvement.\",\n  \"required_decision\": \"Choose a fixed workflow when the permitted steps and recovery conditions are known and dynamic selection adds little value\"\n}",
      "explanation": "A source-linked reasoning fixture. JSON parsing checks representation only; reproduce the actual mechanism with the chapter reference.",
      "output": "No runtime or production measurement is inferred from this reasoning fixture."
    },
    "production_case": "A three-step policy lookup becomes a five-agent debate with more latency but no measurable quality improvement.",
    "alternatives": [
      "A representative task set where adaptive choices improve meaningful outcomes enough to justify additional cost, failure paths and review burden."
    ],
    "pitfalls": [
      "A three-step policy lookup becomes a five-agent debate with more latency but no measurable quality improvement."
    ],
    "complexity": "Include workload size, retained state, latency, concurrency and recovery work under the declared assumptions; the reasoning fixture is not a capacity benchmark.",
    "follow_ups": [
      {
        "Q": "What evidence would justify the more dynamic pattern?",
        "A": "A representative task set where adaptive choices improve meaningful outcomes enough to justify additional cost, failure paths and review burden."
      }
    ],
    "citations": [
      "https://adk.dev/evaluate/"
    ],
    "reviewer_status": {
      "status": "draft",
      "reviewer": "Independent review pending",
      "reviewed_at": "2026-10-21"
    }
  }
]
