[
  {
    "Q": "Why must embedding model identity and preprocessing be part of an index migration?",
    "spoken": "Vectors are meaningful under their producing model, dimensions, normalization and input preparation. Do not mix incompatible generations or query a new model against old vectors without a verified compatibility claim. Build a new projection, evaluate representative and permission slices, then promote with a rollback plan and explicit generation identity.",
    "A": "Vectors are meaningful under their producing model, dimensions, normalization and input preparation. Do not mix incompatible generations or query a new model against old vectors without a verified compatibility claim. Build a new projection, evaluate representative and permission slices, then promote with a rollback plan and explicit generation identity.\n\nConcrete engineering case: An index accepts the same vector dimension from another model, but semantic ranking collapses despite no type error.\n\nBoundary defense: No. They establish only a shape. The learned representation and metric contract can still differ.",
    "Why": "Vectors are meaningful under their producing model, dimensions, normalization and input preparation. Do not mix incompatible generations or query a new model against old vectors without a verified compatibility claim. Build a new projection, evaluate representative and permission slices, then promote with a rollback plan and explicit generation identity.",
    "Risk": "An index accepts the same vector dimension from another model, but semantic ranking collapses despite no type error.",
    "Trade": "No. They establish only a shape. The learned representation and metric contract can still differ.",
    "Try": "Reproduce this case with synthetic data, state the authoritative result and show a regression that rejects the broken behavior.",
    "domain": "mathematics",
    "subdomain": "embeddings",
    "module": "embeddings",
    "concept": "Why must embedding model identity and preprocessing be part of an index migration?",
    "difficulty": "scenario",
    "misconception_target": "Assuming this concrete failure is excluded by a happy-path success: An index accepts the same vector dimension from another model, but semantic ranking collapses despite no type error.",
    "definitions": [
      {
        "term": "Boundary: embeddings",
        "definition": "Vectors are meaningful under their producing model, dimensions, normalization and input preparation."
      }
    ],
    "execution_timeline": "Identify the authoritative state → trace the failure boundary → inspect durable or visible evidence → test the proposed recovery",
    "example": {
      "code": "{\n  \"scenario\": \"An index accepts the same vector dimension from another model, but semantic ranking collapses despite no type error.\",\n  \"required_decision\": \"Vectors are meaningful under their producing model, dimensions, normalization and input preparation\"\n}",
      "explanation": "A source-linked reasoning fixture. JSON parsing checks representation only; reproduce the actual mechanism with the chapter reference.",
      "output": "No runtime or production measurement is inferred from this reasoning fixture."
    },
    "production_case": "An index accepts the same vector dimension from another model, but semantic ranking collapses despite no type error.",
    "alternatives": [
      "No. They establish only a shape. The learned representation and metric contract can still differ."
    ],
    "pitfalls": [
      "An index accepts the same vector dimension from another model, but semantic ranking collapses despite no type error."
    ],
    "complexity": "Include workload size, retained state, latency, concurrency and recovery work under the declared assumptions; the reasoning fixture is not a capacity benchmark.",
    "follow_ups": [
      {
        "Q": "Do matching dimensions prove compatibility?",
        "A": "No. They establish only a shape. The learned representation and metric contract can still differ."
      }
    ],
    "citations": [
      "https://arxiv.org/abs/1706.03762",
      "https://arxiv.org/abs/1603.09320"
    ],
    "reviewer_status": {
      "status": "reviewed",
      "reviewer": "Codex AI technical review (user-delegated verdict; authored/self-reviewed)",
      "reviewed_at": "2026-10-24"
    }
  }
]
