[
  {
    "Q": "How do you evaluate chunk overlap without counting duplicate evidence as extra recall?",
    "spoken": "Define relevance at the appropriate source or passage identity, deduplicate overlapping hits under that evaluation contract and inspect answer-support coverage. Overlap can preserve context but increases storage, repeated tokens and correlated results. Evaluate boundary cases such as headings, exceptions and table rows instead of choosing chunk size solely by a convenient token number.",
    "A": "Define relevance at the appropriate source or passage identity, deduplicate overlapping hits under that evaluation contract and inspect answer-support coverage. Overlap can preserve context but increases storage, repeated tokens and correlated results. Evaluate boundary cases such as headings, exceptions and table rows instead of choosing chunk size solely by a convenient token number.\n\nConcrete engineering case: Five top results are overlapping windows from one paragraph while the policy exception lives just outside all of them.\n\nBoundary defense: No. Inspect structural boundaries, document parsing and retrieval diversity. More duplicate context can crowd out the needed evidence.",
    "Why": "Define relevance at the appropriate source or passage identity, deduplicate overlapping hits under that evaluation contract and inspect answer-support coverage. Overlap can preserve context but increases storage, repeated tokens and correlated results. Evaluate boundary cases such as headings, exceptions and table rows instead of choosing chunk size solely by a convenient token number.",
    "Risk": "Five top results are overlapping windows from one paragraph while the policy exception lives just outside all of them.",
    "Trade": "No. Inspect structural boundaries, document parsing and retrieval diversity. More duplicate context can crowd out the needed evidence.",
    "Try": "Reproduce this case with synthetic data, state the authoritative result and show a regression that rejects the broken behavior.",
    "domain": "ai-rag",
    "subdomain": "chunking",
    "module": "chunking",
    "concept": "How do you evaluate chunk overlap without counting duplicate evidence as extra recall?",
    "difficulty": "scenario",
    "misconception_target": "Assuming this concrete failure is excluded by a happy-path success: Five top results are overlapping windows from one paragraph while the policy exception lives just outside all of them.",
    "definitions": [
      {
        "term": "Boundary: chunking",
        "definition": "Define relevance at the appropriate source or passage identity, deduplicate overlapping hits under that evaluation contract and inspect answer-support coverage."
      }
    ],
    "execution_timeline": "Identify the authoritative state → trace the failure boundary → inspect durable or visible evidence → test the proposed recovery",
    "example": {
      "code": "{\n  \"scenario\": \"Five top results are overlapping windows from one paragraph while the policy exception lives just outside all of them.\",\n  \"required_decision\": \"Define relevance at the appropriate source or passage identity, deduplicate overlapping hits under that evaluation contract and inspect answer-support coverage\"\n}",
      "explanation": "A source-linked reasoning fixture. JSON parsing checks representation only; reproduce the actual mechanism with the chapter reference.",
      "output": "No runtime or production measurement is inferred from this reasoning fixture."
    },
    "production_case": "Five top results are overlapping windows from one paragraph while the policy exception lives just outside all of them.",
    "alternatives": [
      "No. Inspect structural boundaries, document parsing and retrieval diversity. More duplicate context can crowd out the needed evidence."
    ],
    "pitfalls": [
      "Five top results are overlapping windows from one paragraph while the policy exception lives just outside all of them."
    ],
    "complexity": "Include workload size, retained state, latency, concurrency and recovery work under the declared assumptions; the reasoning fixture is not a capacity benchmark.",
    "follow_ups": [
      {
        "Q": "Can increasing overlap always repair the missing exception?",
        "A": "No. Inspect structural boundaries, document parsing and retrieval diversity. More duplicate context can crowd out the needed evidence."
      }
    ],
    "citations": [
      "https://arxiv.org/abs/2005.11401"
    ],
    "reviewer_status": {
      "status": "reviewed",
      "reviewer": "Codex AI technical review (user-delegated verdict; authored/self-reviewed)",
      "reviewed_at": "2026-10-24"
    }
  }
]
