[
  {
    "Q": "How should a skill’s instructions interact with tool permissions and business policy?",
    "spoken": "A skill supplies reusable guidance or procedures, not a new grant of authority. The host and service must still enforce available capabilities, caller scope and approval boundaries. Treat external skill content as versioned input with provenance and inspect what actions it can cause, especially when it references other resources.",
    "A": "A skill supplies reusable guidance or procedures, not a new grant of authority. The host and service must still enforce available capabilities, caller scope and approval boundaries. Treat external skill content as versioned input with provenance and inspect what actions it can cause, especially when it references other resources.\n\nConcrete engineering case: A downloaded skill asks a tool to read unrelated private files and forward them to another system.\n\nBoundary defense: No. Trust and authority are established by the host and application policy, not by self-description in the skill text.",
    "Why": "A skill supplies reusable guidance or procedures, not a new grant of authority. The host and service must still enforce available capabilities, caller scope and approval boundaries. Treat external skill content as versioned input with provenance and inspect what actions it can cause, especially when it references other resources.",
    "Risk": "A downloaded skill asks a tool to read unrelated private files and forward them to another system.",
    "Trade": "No. Trust and authority are established by the host and application policy, not by self-description in the skill text.",
    "Try": "Reproduce this case with synthetic data, state the authoritative result and show a regression that rejects the broken behavior.",
    "domain": "ai-rag",
    "subdomain": "skills-layers",
    "module": "skills-layers",
    "concept": "How should a skill’s instructions interact with tool permissions and business policy?",
    "difficulty": "scenario",
    "misconception_target": "Assuming this concrete failure is excluded by a happy-path success: A downloaded skill asks a tool to read unrelated private files and forward them to another system.",
    "definitions": [
      {
        "term": "Boundary: skills layers",
        "definition": "A skill supplies reusable guidance or procedures, not a new grant of authority."
      }
    ],
    "execution_timeline": "Identify the authoritative state → trace the failure boundary → inspect durable or visible evidence → test the proposed recovery",
    "example": {
      "code": "{\n  \"scenario\": \"A downloaded skill asks a tool to read unrelated private files and forward them to another system.\",\n  \"required_decision\": \"A skill supplies reusable guidance or procedures, not a new grant of authority\"\n}",
      "explanation": "A source-linked reasoning fixture. JSON parsing checks representation only; reproduce the actual mechanism with the chapter reference.",
      "output": "No runtime or production measurement is inferred from this reasoning fixture."
    },
    "production_case": "A downloaded skill asks a tool to read unrelated private files and forward them to another system.",
    "alternatives": [
      "No. Trust and authority are established by the host and application policy, not by self-description in the skill text."
    ],
    "pitfalls": [
      "A downloaded skill asks a tool to read unrelated private files and forward them to another system."
    ],
    "complexity": "Include workload size, retained state, latency, concurrency and recovery work under the declared assumptions; the reasoning fixture is not a capacity benchmark.",
    "follow_ups": [
      {
        "Q": "Can an instruction saying this skill is trusted bypass the boundary?",
        "A": "No. Trust and authority are established by the host and application policy, not by self-description in the skill text."
      }
    ],
    "citations": [
      "https://agentskills.io/specification"
    ],
    "reviewer_status": {
      "status": "reviewed",
      "reviewer": "Codex AI technical review (user-delegated verdict; authored/self-reviewed)",
      "reviewed_at": "2026-10-24"
    }
  }
]
